"ReportId","ScheduleId","ScheduleIId","CommitteeContactId","FirstName","MiddleName","LastOrCompanyName","Prefix","Suffix","AddressLine1","AddressLine2","City","StateCode","ZipCode","IsIndividual","TransactionDate","Amount","AuthorizingName","TypeOfDisposition","ReportUID"
"14750","","163","79144","","","Richmond Public Schools Education Foundation","","","301 North Ninth Street","17th Floor","Richmond","VA","23219","False","01/12/2013","24.69","Shonda Harris Muhammed","Donation of surplus fund to foundation, Check 5536","{31DAAE72-C06B-B359-960B-CD1585F76E06}"
"14966","","164","86001","","","Gloucester County Republican Committee","","","P.O. Box 122","","Gloucester","VA","23061","False","02/01/2013","1346.66","Carter Borden","Surplus funds donated to local Republican committee","{A73D6970-0CEB-FA11-4D1D-01100790A213}"
"15244","","165","86889","","","Friends of Tim McGhee (2011 Senate Committee)","","","1420 W Abingdon Dr","Unit 104","Alexandria","VA","22314","False","03/28/2013","1357.86","T. McGhee","Contribution","{F97C86ED-8AAF-28F0-1CC8-055EF7A5BD5D}"
"15403","","168","87827","","","Friends of John Frey","","","P.O. 2096","","Springfield","VA","22152","False","03/29/2013","447.92","John Frey","Transfer to Clerk of Court Campaign Account","{390E4248-EAB8-62A3-8444-AC92DCEA195A}"
"15803","","169","61605","Mark","","Jainchell","","","8849 Lyndale Drive","","North Chesterfield","VA","23235","True","04/05/2013","24.05","Mark Jainchell","Refund Of Contribution","{A2DADDB7-A0B2-0A51-54B6-088D8317D727}"
